"conversation_id_str","created_at","favorite_count","full_text","id_str","image_url","in_reply_to_screen_name","lang","location","quote_count","reply_count","retweet_count","tweet_url","user_id_str","username"
"1845344065996599407","Sun Oct 13 06:01:24 +0000 2024","1","BMW menabrak sparator busway hingga terbalik dan mengalami kerusakan parah di Jalan Warung Buncit Raya dari Ragunan mengarah ke Mampang Prapatan tepatnya setelah trafficlight Graha Indomonang https://t.co/M7O8Yl0GCO","1845344065996599407","https://pbs.twimg.com/media/GZv6jS3a0AARVvR.jpg","","in","Jakarta Timur, DKI Jakarta","0","0","0","https://x.com/almachzumi/status/1845344065996599407","60612319","almachzumi"
"1844332591794774102","Thu Oct 10 11:02:10 +0000 2024","2","When life feels good. Gajadi ngantor akhirnya wfc dari jam 12 pulang jam 4 sore jalanan udh lumayan adem naik busway masih sepi &amp; dingin https://t.co/siutBYSfiJ","1844332591794774102","https://pbs.twimg.com/media/GZhitppbIAAj4Rk.jpg","","in","","0","1","0","https://x.com/g0ldenhaz3/status/1844332591794774102","165352968","g0ldenhaz3"
"1845331725108511190","Sun Oct 13 05:12:22 +0000 2024","5","Ada yg tahu tdk ini dimana ? Aku ingin tahu sjatinya Jembatan Busway yg hny utk menuju ke sebrang dibuat berkelok2 panjang jalurnya utk apa ya bknkah itu jdi habiskan byk Anggaran ya ? https://t.co/G7lWHkZviC","1845331725108511190","https://pbs.twimg.com/ext_tw_video_thumb/1845331683589095425/pu/img/mLMvvP5vkfyh_T33.jpg","","in","Indonesia","0","1","2","https://x.com/RatnaPuspi16942/status/1845331725108511190","1688663918099812353","RatnaPuspi16942"
"1845246080818217396","Sat Oct 12 23:32:03 +0000 2024","3795","06.31: Info kecelakaan tunggal sebuah mobil BMW menabrak sparator busway hingga terbalik dan mengalami kerusakan parah di Jalan Warung Buncit Raya dari Ragunan mengarah ke Mampang Prapatan tepatnya setelah trafficlight Graha Indomonang saat ini sedang dalam penanganan petugas. https://t.co/71SVEZ7y4W","1845246080818217396","https://pbs.twimg.com/media/GZuheBQaAAEr7Ab.jpg","","in","","269","297","399","https://x.com/RadioElshinta/status/1845246080818217396","121640063","RadioElshinta"
"1844289439687901593","Thu Oct 10 08:10:42 +0000 2024","2","Gerakan #BacadiTransum udh dari lama banget aku lakuin. Karena bawa buku kemana2 soalnya takut bosen aja kalo main hape terus. Tpi gak enaknya kalo lagi part yg seru gak bisa teriak2 / guling2 Foto2 ini aku baca di Angkot di Kereta di LRT dan busway gak ada fotonya huhu https://t.co/qNFWqzaysc","1844289439687901593","https://pbs.twimg.com/media/GZg7dKyaAAIwy1A.jpg","","in","Jakarta, Indonesia","1","0","1","https://x.com/liiaaa_/status/1844289439687901593","912042943","liiaaa_"
"1844229278294213084","Thu Oct 10 04:11:38 +0000 2024","28","Pada Juni 2014 Pemprov DKI Jakarta menerima 30 unit Single Bus Transjakarta dari 3 Perusahaan Swasta yakni Telkomsel Ti-phone dan Roda Mas Group Unit ini menggunakan sasis Hino RK8 dengan body New Celcius garapan Karoseri Rahayu Santosa https://t.co/kz4DdqnWuS","1844229278294213084","https://pbs.twimg.com/media/GZgEv_MaAAA-K4C.jpg","","in","Jakarta Capital Region","0","1","4","https://x.com/BuswayFansC/status/1844229278294213084","2394713818","BuswayFansC"
"1845328370529337562","Sun Oct 13 04:59:02 +0000 2024","329","Kalau bukan separator fisik apa yg menjamin mobil tdk masuk jalur busway? Indonesia Negara Hukum","1845328370529337562","","","in","Sumbermanjing","1","12","61","https://x.com/Outstandjing/status/1845328370529337562","59363362","Outstandjing"
"1843914883714429087","Wed Oct 09 07:22:21 +0000 2024","3","pengalaman pertama naik busway blm apa2 ditegur ibu2 krn duduk di bangku khusus cewek kalau dipangkuannya dia boleh https://t.co/QCEaNuvHVj","1843914883714429087","https://pbs.twimg.com/media/GZbmz2XasAEWC8e.jpg","","in","Singapore","0","4","0","https://x.com/ayanggakingetin/status/1843914883714429087","1563893784546381824","ayanggakingetin"
"1843866985920377046","Wed Oct 09 04:12:01 +0000 2024","7","Zoe Busway siapanya Tatang Karbu sama Asep Radiator??","1843866985920377046","","","in","Bandung, Jawa Barat","0","0","2","https://x.com/ZONKIM0N/status/1843866985920377046","1094213780894928896","ZONKIM0N"
"1845446507807567932","Sun Oct 13 12:48:28 +0000 2024","0","Kalau dua pekan yang lalu nyoba treatment di Kokuo kali ini nyoba di NEST Family Reflexology. Guest complimentary: - Bubur kacang hijau; - Cleo; - Wedang jahe. NEST Family Reflexology Sunter Tanjung Priok. https://t.co/SNCMk72UYD","1845446507807567932","https://pbs.twimg.com/media/GZxXzPVaAAM7DRz.jpg","","in","Priority Seat","0","0","0","https://x.com/26Ceicei/status/1845446507807567932","124639815","26Ceicei"
"1844575780342497692","Fri Oct 11 03:08:31 +0000 2024","3","Hai moots hari ini aku mau traktir kamu jajanan senilai 100k di alfamart ya. Untuk 1 org yg tepat dan cepat bisa tebak ini di jalan apa? (Sebutin nama jalannya ya). Clue nya : Jakarta ada jalanan busway ada kali. Have a nice day https://t.co/VBkgydYYzG","1844575780342497692","https://pbs.twimg.com/media/GZk_48iaIAAoT-L.jpg","","in","Jakarta","1","6","0","https://x.com/Kecoua_terbang/status/1844575780342497692","2251632476","Kecoua_terbang"
"1843910909816910189","Wed Oct 09 07:06:33 +0000 2024","2","Gus Zizan yang di halu in sama Ning Maghrib sedang viral di club bersama Zoey Busway. https://t.co/WNcwIH9Kqn","1843910909816910189","https://pbs.twimg.com/media/GZbjMvSasAAGL80.jpg","","in","RT/RW","0","0","0","https://x.com/hugetcigalpa/status/1843910909816910189","810785507714052096","hugetcigalpa"
"1844229278294213084","Thu Oct 10 04:13:18 +0000 2024","7","Untuk penomoran body unit ini sempat mengalami perubahan. Sebelumnya nolam TJSB-0001 s/d TJSB-0030 berubah jadi TJSB-0127 s/d TJSB-0156 Si Ciyus Merah ini sudah tidak beroperasi lagi &amp; kabarnya masuk ke dalam unit yang akan dilelangkan bersama dengan unit eks JET Yutong Ankai https://t.co/WPJcnLpbEv","1844229695203897447","https://pbs.twimg.com/media/GZgFIOEa4AESD2n.jpg","BuswayFansC","in","Jakarta Capital Region","0","1","1","https://x.com/BuswayFansC/status/1844229695203897447","2394713818","BuswayFansC"
"1844229278294213084","Thu Oct 10 04:14:55 +0000 2024","3","Lho Pak Anthony berminat (?) https://t.co/Kq5wqumSgQ","1844230103284470171","https://pbs.twimg.com/media/GZgFfsiaAAI7EKY.jpg","BuswayFansC","in","Jakarta Capital Region","0","0","1","https://x.com/BuswayFansC/status/1844230103284470171","2394713818","BuswayFansC"
"1845266578948096339","Sun Oct 13 00:53:30 +0000 2024","0","Pertama kalinya naik busway tapi lewat tol. Apa karna CFD yaa","1845266578948096339","","","in","Earth","0","1","0","https://x.com/bukanrajaa/status/1845266578948096339","374868689","bukanrajaa"
"1843529051224637682","Tue Oct 08 05:49:11 +0000 2024","1","Bro this happens to me ALL THE TIME kek lo g pernah spek koko koko chindo yg kerjaanny jadi model naik busway kah kita juga ada budget pls apalagi pergi kerja/ biasa doang g perlu cakep cakep","1843529051224637682","","","in","Jakarta Capital Region","0","0","0","https://x.com/aldoinblue/status/1843529051224637682","1002841469441327104","aldoinblue"
"1844178114987032690","Thu Oct 10 00:48:20 +0000 2024","8","inii yg jualan nasi uduk geraknya slowmo bgt ajgggggg keburu busway gua dtgggg‍↔️‍↔️","1844178114987032690","","","in","u’re my penicillium","0","1","0","https://x.com/ursflo/status/1844178114987032690","1542127071639801858","ursflo"
"1844048714941473050","Wed Oct 09 16:14:09 +0000 2024","2","Nasi putih x sup sapi dengan minyak samin. Sop Kaki Kambing Tiga Saudara Jatiwaringin. https://t.co/MmLuIXff5o","1844048714941473050","https://pbs.twimg.com/media/GZdgiF1aAAE78XT.jpg","","in","Priority Seat","0","0","0","https://x.com/26Ceicei/status/1844048714941473050","124639815","26Ceicei"
"1845519638358351886","Sun Oct 13 17:39:04 +0000 2024","0","Baru nyampe rumah jam segini sepanjang jalan ga berhenti meluk si satu ini. Di busway aja masih nangis masih gemetaran sampai sekarang saking ga percayanya https://t.co/DbsJf5XZhf","1845519638358351886","https://pbs.twimg.com/media/GZyaVJ-bwAAjii1.jpg","","in","DKI Jakarta, Indonesia","0","0","0","https://x.com/darumdarindasvt/status/1845519638358351886","514399114","darumdarindasvt"
"1843799861436789146","Tue Oct 08 23:45:17 +0000 2024","18","Byun Baekhyun kamu live dari aku bangun solat subuh aku tidur lagi sbntr trus bangun siap2 berangkat kerja sampeeee detik ini aku udah di busway KAMU MASIH LIVE?! GILEEEE LU NDRO KAMU GA KERJA YA HARI Ini? gaada schedule? YA IYASI ELU BOS NYE serah mau dtg jmbrp https://t.co/8TrvHIF3yF","1843799861436789146","https://pbs.twimg.com/media/GZZ-MmoasAYzbWJ.jpg","","in","","0","3","2","https://x.com/bianxiviar/status/1843799861436789146","1418695021574774786","bianxiviar"
"1844549085124231457","Fri Oct 11 01:22:26 +0000 2024","0","IHH ANJRITVLAH GW DI BUSWAY https://t.co/qhd6lZHDeu","1844549085124231457","https://pbs.twimg.com/media/GZknnHGbsAAvLUM.jpg","","in","   she/her ","0","0","0","https://x.com/efairyone/status/1844549085124231457","1291648687349760002","efairyone"
"1844305407445266480","Thu Oct 10 09:14:09 +0000 2024","0","Ngeri ngeri sedep macet gue dibelakang busway gini. Mana otak gue suka mikir aneh² jauh jauh yallahh lindungin hambamu ini dimanapun dan kapanpun hamba berada https://t.co/m8Xiduseoe","1844305407445266480","https://pbs.twimg.com/media/GZhJ_j8aAAAbNqC.jpg","","in","DKI Jakarta, Indonesia","0","0","0","https://x.com/sydudeee/status/1844305407445266480","1205075220261814273","sydudeee"
"1844562045334847620","Fri Oct 11 02:13:56 +0000 2024","0","Jalur busway aja macet bgt https://t.co/Xw5zAg5LcZ","1844562045334847620","https://pbs.twimg.com/media/GZkzZf0a0AAy8N0.jpg","","in","Sapen, Yogyakarta","0","0","0","https://x.com/baksotongkool/status/1844562045334847620","3287969886","baksotongkool"
"1845275292442689921","Sun Oct 13 01:28:07 +0000 2024","0","ooooo lali iki dikiro separator busway sek sependek 12th yang lalu?","1845275292442689921","","","in","Singapore","0","0","0","https://x.com/Joeaaan99/status/1845275292442689921","1685072090289012736","Joeaaan99"
"1845387869264937384","Sun Oct 13 08:55:28 +0000 2024","0","Wkwk tapi sering bgt tuh gue liatnpada nerobos jalan busway","1845387869264937384","","","in","Loeyvers 🪐","0","0","0","https://x.com/shelloeynih/status/1845387869264937384","1554810022214766592","shelloeynih"
"1845232780931891660","Sat Oct 12 22:39:12 +0000 2024","0","ini ada apaan dah di jalan masa busway no 6 diputer ke tendean","1845232780931891660","","","in","they/them (unisex)","0","1","0","https://x.com/mwanzaxen/status/1845232780931891660","1161675791794503681","mwanzaxen"
"1845278432936206795","Sun Oct 13 01:40:36 +0000 2024","0","dengerin lagu ini setiap pagi pas turun dari halte busway ke spot nunggu ojol cos it fits the vibe hearing it live is making me feel ALL THE FEELS","1845278432936206795","","","in","","0","1","0","https://x.com/bitterfritter_/status/1845278432936206795","1367192808906395649","bitterfritter_"
"1844424402366280126","Thu Oct 10 17:06:59 +0000 2024","5","serem bgt ada mobil nabrak pembatas jalan busway sebelum stasiun cawang tiati gusyy gausah ngebut ngebut kalo nyetir","1844424402366280126","","","in","","0","3","0","https://x.com/bby_baeee/status/1844424402366280126","1584753655676166145","bby_baeee"
"1843653736037789921","Tue Oct 08 14:04:38 +0000 2024","0","GUE PENGEN KETAWA TPI GUE MASIH DI BUSWAY ","1843653736037789921","","","in","rps ","0","0","0","https://x.com/mnwonnz/status/1843653736037789921","3507244093","mnwonnz"
"1845266773417091285","Sun Oct 13 00:54:16 +0000 2024","2","gue baru tau busway kearah monas ditutup anjir","1845266773417091285","","","in","","0","1","0","https://x.com/eskecombrang/status/1845266773417091285","1737867305768648704","eskecombrang"
"1845306941817618522","Sun Oct 13 03:33:53 +0000 2024","0","galucu bgt gue nahan tangis lg busway ","1845306941817618522","","","in","RIIZE IS 7 ","0","0","0","https://x.com/eunstonethu/status/1845306941817618522","1709170473500893184","eunstonethu"
"1845003402998390913","Sat Oct 12 07:27:44 +0000 2024","0","CW // Politik Sobat jkt jgn pilih org halu ini pls gw gamau krl subsidinya dicabut dan halte busway jadi bobrok plus jkt makin semrawut.... pls....","1845003402998390913","","","in","icon : @/tubosite (manda)","0","1","0","https://x.com/touakiss/status/1845003402998390913","1641083182115340288","touakiss"
"1844518584372154780","Thu Oct 10 23:21:14 +0000 2024","18","06.20 Sebuah kendaraan Truk mengalami Kecelakaan Tunggal menabrak Separator Busway di Jl S. Parman Jakbar (depan KFC) arah Slipi saat ini sedang dalam penanganan oleh Petugas Situasi arus lalu lintas di Sekitar Lokasi terpantau cukup padat. https://t.co/6ZYf9PzTPC","1844518584372154780","https://pbs.twimg.com/media/GZkL3aNaQAANH3x.jpg","","in","DKI Jakarta, Indonesia","20","5","5","https://x.com/TMCPoldaMetro/status/1844518584372154780","76647722","TMCPoldaMetro"
"1844387701258322430","Thu Oct 10 14:41:09 +0000 2024","0","by the way on the way busway itu gac0an d bwi jl soetomo tu kapan ya bukanya fagh lah men","1844387701258322430","","","in","Malang, Jawa Timur","0","1","0","https://x.com/shelbyfamly/status/1844387701258322430","4773243673","shelbyfamly"
"1843696696347476191","Tue Oct 08 16:55:21 +0000 2024","2","khasshom ydiru l wifi fl busway tahuwa","1843696696347476191","","","in","","0","0","0","https://x.com/mrymgotbanned/status/1843696696347476191","1709929551885922304","mrymgotbanned"
"1844163096853750034","Wed Oct 09 23:48:39 +0000 2024","0","Tumbenan gw jam segini udh di busway dan udh setengah jalan ke kantor","1844163096853750034","","","in","","0","0","0","https://x.com/galeuygalakian/status/1844163096853750034","1572594407794417664","galeuygalakian"
"1845015112123548146","Sat Oct 12 08:14:16 +0000 2024","1","faakkk panas-panas begini ada aja orang yg make parfum vanilla wangi nya mana se busway lagi bjir ((menahan pusink))","1845015112123548146","","","in","indonesia","0","3","0","https://x.com/bitterflos/status/1845015112123548146","1832685522445332484","bitterflos"
"1845581823415636135","Sun Oct 13 21:46:10 +0000 2024","0","Ada CSW ada jembatan Velbak-Kebayoran Lama ada jembatan LRT-Busway-Stasiun cawang dll. Kalau PI mau connect dengan MRT/busway ya bagus2 aja. Kalau cuma buat nyebrang jalan thamrin ya udah bener pelican crossing.","1845581823415636135","","","in","Jakarta","0","0","0","https://x.com/farhan_fevrier/status/1845581823415636135","127091984","farhan_fevrier"
"1843665759651934211","Tue Oct 08 14:52:25 +0000 2024","0","Busway masih kecolongan kendaraan pribadi. Alhasil transportasi umum sama kena macet juga. Gimana masyarakat mau beralih ke transum kalo benefitnya hanya murah? Kalo jumlah personil Polantas/Dishub gk cukup buat mantau busway dari kendaraan pribadi ya tinggal maksimalin ETLE.","1843665759651934211","","","in","","0","0","0","https://x.com/baslightyearrr/status/1843665759651934211","1342764133003902981","baslightyearrr"
"1843628821284884780","Tue Oct 08 12:25:38 +0000 2024","0","Wth this day. Mulai pagi hadapin tetangga rese dibusway w ga duduk yg biasanya berangkat selalu kosong pagi2 pulangnya dibusway w harus diri total diri hari ini 4 jam di busway hampir mubtah krn stella jalanan pulangpun macet bgttt sampe ham segini?? https://t.co/kIO8pPP62b","1843628821284884780","https://pbs.twimg.com/media/GZXiowXasAIuQha.jpg","","in","","0","0","0","https://x.com/bankbalanceshit/status/1843628821284884780","1048978694771859457","bankbalanceshit"
"1844680832327483752","Fri Oct 11 10:05:57 +0000 2024","0","Bela²in pulang naik busway buat jajan uli bakar ini. Enak kalo pas masih anget² sambil ditemani secangkir kopi. https://t.co/7SO6vrEguG","1844680832327483752","https://pbs.twimg.com/media/GZmfbrRbgAA_yfT.jpg","","in","Di Sokin","0","0","0","https://x.com/ikiy/status/1844680832327483752","62209120","ikiy"
"1843600076612206684","Tue Oct 08 10:31:25 +0000 2024","3","bisa gak sih semua jalur busway tuh diatas aja jgn nyampur sama mobil pribadi..","1843600076612206684","","","in","","0","0","0","https://x.com/azzhrrra/status/1843600076612206684","1816460690997301248","azzhrrra"
"1843661561896001983","Tue Oct 08 14:35:44 +0000 2024","0","Halte tj terbuka gitu buat apa ada ac anjir mikir dikit lah Mendinh lu banyakin armada pasang portal di jalur khusus busway biar ga ada pengendara bodoh yg pakai jalur busway. ac buat apa anjenggg","1843661561896001983","","","in","247WithUs","0","1","0","https://x.com/shinyouz/status/1843661561896001983","1728356471216472064","shinyouz"
"1843931525206958482","Wed Oct 09 08:28:28 +0000 2024","3","Di busway ketemu cowo wangi + cakep banget mau kuajak check in langsung takut lancang padahala udah basah dikit nih","1843931525206958482","","","in","","0","2","0","https://x.com/frlidge/status/1843931525206958482","902623206447525888","frlidge"
"1843788392326410462","Tue Oct 08 22:59:43 +0000 2024","0","Kenapa dah tiap naik busway ada orang tidur samping gw pasti senderan ke bahu gw","1843788392326410462","","","in","","0","0","0","https://x.com/nanayeah_/status/1843788392326410462","867932569366544385","nanayeah_"
"1844553927808909628","Fri Oct 11 01:41:41 +0000 2024","16","Proses pembersihan kendaraan Truk mengalami Kecelakaan Tunggal menabrak Separator Busway di Jl S. Parman Jakbar (depan KFC) arah Slipi situasi arus lalu lintas di Sekitar Lokasi terpantau cukup padat. https://t.co/1ArhTn39GD","1844553927808909628","https://pbs.twimg.com/ext_tw_video_thumb/1844553299082760192/pu/img/sYXVB57C8QU_PVUA.jpg","","in","DKI Jakarta, Indonesia","6","3","7","https://x.com/TMCPoldaMetro/status/1844553927808909628","76647722","TMCPoldaMetro"
"1844334833243389994","Thu Oct 10 11:11:04 +0000 2024","0","saya besok akan mencoba 6A/6C pokoknya bus tipe favorite aku yg ngga perlu naik jembatan sakaratul maut busway itu pokoknya.","1844334833243389994","","","in","","0","0","0","https://x.com/Ichavarma_/status/1844334833243389994","1545271727521169411","Ichavarma_"
"1843597516635549988","Tue Oct 08 10:21:15 +0000 2024","0","Saran manhwa yang enak dibaca sambil nunggu busway.","1843597516635549988","","","in","I, Altheano Bagaskara. (24+)","0","1","0","https://x.com/Altheanoo/status/1843597516635549988","1669395890170384385","Altheanoo"
"1845354664738607360","Sun Oct 13 06:43:31 +0000 2024","2","13.40 #InfoSonora Kecelakaan tunggal mobil BMW menabrak sparator busway hingga terbalik &amp; mengalami kerusakan parah di Jln Warung Buncit Raya dari Ragunan mengarah ke Mampang Prapatan tepatnya setelah TL Graha Indomonang tadi pagi pk. 06.30 WIB ( via BP. Winarno) https://t.co/jVDCJixtns","1845354664738607360","https://pbs.twimg.com/media/GZwESZuaAAAsnP1.jpg","","in","Jakarta Barat, DKI Jakarta","1","0","0","https://x.com/SonoraFM92/status/1845354664738607360","180696019","SonoraFM92"
"1845089051130593356","Sat Oct 12 13:08:04 +0000 2024","1","Demi apa gw td di halte smbil nunggu busway iseng joget beginian jg wkwkwkk","1845089051130593356","","","in","13","0","0","1","https://x.com/wonunginomu/status/1845089051130593356","794314257483460608","wonunginomu"
"1845386816431718716","Sun Oct 13 08:51:17 +0000 2024","0","Pernah abis dr busway denger lagu ini on shuffle sepanjang jalan dr halte ke rumah nangis. Tiba2 turun aja air mata","1845386816431718716","","","in","","0","0","0","https://x.com/dhetaesha/status/1845386816431718716","981863587","dhetaesha"
"1845484647821824387","Sun Oct 13 15:20:02 +0000 2024","0","aku udah pulang yaa hari ini seru juga ya naik busway kamu gimana hari ini?? *misalkan","1845484647821824387","","","in","jakarta","0","3","0","https://x.com/fwbale/status/1845484647821824387","1514659489479217152","fwbale"
"1844532583079788995","Fri Oct 11 00:16:52 +0000 2024","2","07.15 #LalinSonora Di dekat pintu tol masuk slipi 2 ada mobil bawa hebel tabrak pembatas busway lalulintas padat kemacetan bisa sampai lampu merah tomang. ( via Bp. Firman Hermanto) https://t.co/5sdsuFolmz","1844532583079788995","https://pbs.twimg.com/ext_tw_video_thumb/1844532502716874753/pu/img/e5w-5kvQX80pB1mN.jpg","","in","Jakarta Barat, DKI Jakarta","0","1","0","https://x.com/SonoraFM92/status/1844532583079788995","180696019","SonoraFM92"
"1845278691112387069","Sun Oct 13 01:41:38 +0000 2024","0","Separator busway: Oke bang sorry bang","1845278691112387069","","","in","","0","0","0","https://x.com/rafenditya/status/1845278691112387069","428953184","rafenditya"
"1844564785125523952","Fri Oct 11 02:24:49 +0000 2024","2","08.45: Proses pembersihan kendaraan Truk mengalami Kecelakaan Tunggal menabrak Separator Busway di Jl S. Parman Jakbar (depan KFC) arah Slipi situasi arus lalu lintas di Sekitar Lokasi terpantau cukup padat. @TMCPoldaMetro https://t.co/rBDyw1jPcN","1844564785125523952","https://pbs.twimg.com/ext_tw_video_thumb/1844564744637919232/pu/img/QsysKJ9jBsA5UZTS.jpg","","in","Jakarta Barat, DKI Jakarta","0","1","2","https://x.com/SonoraFM92/status/1844564785125523952","180696019","SonoraFM92"
"1845611361432371395","Sun Oct 13 23:43:33 +0000 2024","0","Traffic busway pagi ini mengingatkan aku pada osaka loop line mggu kmrn ","1845611361432371395","","","in","Worldwide","0","0","0","https://x.com/ppuyuna/status/1845611361432371395","1601938857598992384","ppuyuna"
"1843907558471561570","Wed Oct 09 06:53:14 +0000 2024","0","sebagai penumpang TJ all day.. gue setuju kata2nya: solusi tidak buruk tapi bukan prioritas exactly gue ga butuh AC gue butuh armada banyak dan jalur busway yang steril","1843907558471561570","","","in","Neverland","0","0","0","https://x.com/salsabilaisme/status/1843907558471561570","1245999940637044736","salsabilaisme"
"1845014442293199034","Sat Oct 12 08:11:36 +0000 2024","0","Trans7 sama TransTV kan acara TV ya nah terus kenapa Transjakarta itu jadi Busway? Haruskan acara TV juga","1845014442293199034","","","in","","0","0","0","https://x.com/MilkteaTaro08/status/1845014442293199034","1384140927162146827","MilkteaTaro08"
"1843998498896904475","Wed Oct 09 12:54:36 +0000 2024","0","Nangissss di busway adalah jalan ninja ku","1843998498896904475","","","in","🦖🐱| XH 240302 241205","0","2","0","https://x.com/arsitekjungsu/status/1843998498896904475","1259263417191260160","arsitekjungsu"
"1845102670446559698","Sat Oct 12 14:02:11 +0000 2024","0","Sama bgt mbak w pngn tinggal di walkable city yg g bikin baju w bau polusi &amp; ga dicatcall or stare. Pengen naik Busway yg g perlu naik jembatan aborsi dulu. Pengen naik mrt yg stasiun ada dmn2 &amp; menjangkau semua area kalo bisa di Pare jg (mimpi lu? ) https://t.co/h2mAo6GGo1","1845102670446559698","https://pbs.twimg.com/media/GZsfGLWaAAQ4fPG.jpg","","in","Kediri","0","1","0","https://x.com/tomatwojuice/status/1845102670446559698","625286034","tomatwojuice"
"1844339590880166113","Thu Oct 10 11:29:59 +0000 2024","0","monyeeeeet gue sebelahan sm org di busway bau ketek bgt MONYETTTTTT","1844339590880166113","","","in","childreamville. ♡ ","0","2","0","https://x.com/menguubah/status/1844339590880166113","1400277862737866754","menguubah"
"1844586915535917509","Fri Oct 11 03:52:46 +0000 2024","0","hidup kadang di busway arah Grogol kadang di bus arah Ubud ‍️ https://t.co/1gesgJwWYm","1844586915535917509","https://pbs.twimg.com/media/GZlKBKkaAAgsIZa.jpg","","in","Jakarta, Indonesia","0","0","0","https://x.com/parkieran/status/1844586915535917509","79695506","parkieran"
"1843554512671506495","Tue Oct 08 07:30:22 +0000 2024","16","berdosa ini namanya pembohongan publik udah gaada harmoni central busway kek gini dan semua halte cawang itu udah direnov semua","1843554512671506495","","","in","Jekardah","0","0","1","https://x.com/desertedminds/status/1843554512671506495","1068890308669128704","desertedminds"
"1845354966434652485","Sun Oct 13 06:44:43 +0000 2024","1","13.40 #InfoSonora Kecelakaan tunggal mobil BMW menabrak sparator busway hingga terbalik &amp; mengalami kerusakan parah di Jln Warung Buncit Raya dari Ragunan mengarah ke Mampang Prapatan tepatnya setelah TL Graha Indomonang tadi pagi pk. 06.30 WIB ( via @almachzumi ) https://t.co/GZ1x1Aqsja","1845354966434652485","https://pbs.twimg.com/ext_tw_video_thumb/1845354942288232453/pu/img/mO8n6jvWzSDYd-ea.jpg","","in","Jakarta Barat, DKI Jakarta","0","0","0","https://x.com/SonoraFM92/status/1845354966434652485","180696019","SonoraFM92"
"1844744775699685428","Fri Oct 11 14:20:02 +0000 2024","1","udah kuliah dari jam 9 sampe jam 5 pulang di jalan naik busway mayan macet sampe rumah jam 7 karna mampir dulu malah ngezoom sampe jam 9 anjir encok say maaf ya tadi gada jbjb sengkuu","1844744775699685428","","","in","NCT127&WISH⚠️","0","2","0","https://x.com/i97jaejpg/status/1844744775699685428","1478790289745580033","i97jaejpg"
"1843704774497317315","Tue Oct 08 17:27:27 +0000 2024","1"," pelanggan yang terhormat selamat datang di bis transjakarta koridor 9 . belum lanjut tuh kalimat udah tidur di ujung pojok busway itu.","1843704774497317315","","","in","SVT 24/7!! (02즈)","0","0","0","https://x.com/kwanffeine/status/1843704774497317315","1734161446093897728","kwanffeine"
"1844534953620697134","Fri Oct 11 00:26:17 +0000 2024","7","07.26: RT @xin_tan : Akibat kecelakaan Truk angkut batako terguling menabrak sparator busway terjadi macet dari sebelum lampu merah Tomang arah ke Semanggi @TMCPoldaMetro @DKIJakarta #InfoLalinElshinta https://t.co/om62ZxQfSq","1844534953620697134","https://pbs.twimg.com/media/GZkau3faAAEX0X4.jpg","","in","","4","1","2","https://x.com/RadioElshinta/status/1844534953620697134","121640063","RadioElshinta"
"1843585704728899659","Wed Oct 09 04:57:16 +0000 2024","1145","@howtodresvvell gus zizan zoe busway dirangkum sama patrick stars. apalah ini anjink","1843878374508474680","","howtodresvvell","in","","8","13","36","https://x.com/rikiarya757/status/1843878374508474680","298952040","rikiarya757"
