"conversation_id_str","created_at","favorite_count","full_text","id_str","image_url","in_reply_to_screen_name","lang","location","quote_count","reply_count","retweet_count","tweet_url","user_id_str","username"
"1822812533826424922","Mon Aug 12 01:49:08 +0000 2024","6158","Padahal jalan utama tuh lancar sepi tapi si mobil2 kocak ini malah pada masuk jalur busway ‍️ Gataunya ada bis tj mogok jadi gabisa kemana2 kan wkwk Cc @TfJakarta @adriansyahyasin https://t.co/7ZlL6MaFyn","1822812533826424922","https://pbs.twimg.com/media/GUvuVXPbIAAj-RE.jpg","","in","日暮里","347","281","1200","https://x.com/ilham_hzrd20/status/1822812533826424922","245681892","ilham_hzrd20"
"1823184561485783255","Tue Aug 13 02:27:27 +0000 2024","128","#PaGie sobat unicorn Jadi siapa yang sudah mengamankan tiket VC @Regie_JKT48 ?? Ayo coba tulis disini Btw anyway busway semangat hari ini Rengji semoga harinya menyenangkan yaaashhh️ https://t.co/yaxaJvAN8U","1823184561485783255","https://pbs.twimg.com/media/GU1Ar2UbkAA4g31.jpg","","in","DKI Jakarta, Indonesia","0","1","10","https://x.com/regilios_ofc/status/1823184561485783255","1725793375125979136","regilios_ofc"
"1823173037778210925","Tue Aug 13 01:41:39 +0000 2024","2","Ih mobil dibayar pake uang pajak rakyat teladan bener lewat jalur busway https://t.co/9CX4TWOGCP","1823173037778210925","https://pbs.twimg.com/media/GU02NvRWAAAFgbg.jpg","","in","","0","0","0","https://x.com/RakhaRakha45/status/1823173037778210925","1799681310103134208","RakhaRakha45"
"1822535310007534035","Sun Aug 11 07:27:33 +0000 2024","6","Kapan lagi gw naik busway https://t.co/BcxTPEgBWP","1822535310007534035","https://pbs.twimg.com/media/GUryM2sasAA7YJF.jpg","","in","","0","1","0","https://x.com/NariyaBlanche/status/1822535310007534035","1476342742179479554","NariyaBlanche"
"1822818530431213744","Mon Aug 12 02:12:58 +0000 2024","144","Kelakuan pemotor egois gabisa tertib. Masuk jalur transjak di ujung ada polisi. Jadi bikin macet karena beberapa maksa keluar dari separator beberapa jadi lawan arah. Ntar ketabrak busway mati baru nyesal. Semoga gue dijauhkan dari orang2 kek gini yg gamau tertib. https://t.co/jGuQvvOTuj","1822818530431213744","https://pbs.twimg.com/ext_tw_video_thumb/1822818480577814529/pu/img/Twxe8Tz3cZEl3sfi.jpg","","in","On the Pitch","3","17","29","https://x.com/_BangFu/status/1822818530431213744","202528790","_BangFu"
"1822642466245554294","Sun Aug 11 14:33:21 +0000 2024","0","lagi nangkring di halte sepupu gue ngeliat JUJUR TAPI TAKUT KIRAIN KETEMU DI TAICHAN ternyata dia blg ngeliat gw lagi cakep banget di halte menunggu busway kaka ngeliat itu kaya naina lagi nangkring cakep banget BENER KANN dengan baju ungu janda ini https://t.co/jj2U9swM9y","1822642466245554294","https://pbs.twimg.com/media/GUtTqe8aIAAbc5H.jpg","","in","","0","2","0","https://x.com/sicknsound/status/1822642466245554294","1647676927073984514","sicknsound"
"1822012859343368246","Fri Aug 09 20:51:31 +0000 2024","0","ASTAGFIRULLAH KU KIRA UDAH JAM 5 KUTUNGGUIN ADZAN TERNYATA EMANG MASIH JAM 4. MANA AKU DAH RAPI TAKUT KETINGGALAN BUSWAY https://t.co/X47cm19t5Z","1822012859343368246","https://pbs.twimg.com/media/GUkXCIDa8AAbb03.jpg","","in","","0","2","0","https://x.com/sarassvvati/status/1822012859343368246","1677638667203153923","sarassvvati"
"1821875055544168451","Fri Aug 09 11:43:56 +0000 2024","0","B1456OO armada JAK 30 trayek meruya - grogol jam 18:38 DENGAN SENGAJA melewatkan penumpang di bus stop busway Duri Kepa padahal kondisi jalan MACET dan armada sedikit. @PT_Transjakarta DITUNGGU BUKTI SANKSI KE ARMADA KARENA INI SUDAH SERING https://t.co/fuYaa4BtTW","1821875055544168451","https://pbs.twimg.com/media/GUiZsOma8AEVQM5.jpg","","in","Jakarta","0","2","0","https://x.com/timmychristiann/status/1821875055544168451","179375583","timmychristiann"
"1822890767817613463","Mon Aug 12 07:00:01 +0000 2024","43","Kumpulan mobil² yang kebelet cepat sampai ini pada nyerobot jalur busway. Eh ternyata di tengah jalan malah pada kena rinja gara² ada bus TJ mogok. Mau kebelet cepat sampai tapi malah pada kena rinja ","1822890767817613463","","","in","Indonesia","0","5","6","https://x.com/txttransportasi/status/1822890767817613463","1617441699613270016","txttransportasi"
"1823297774861037718","Tue Aug 13 09:57:19 +0000 2024","0","slalu bersyukur dpt duduk mlu stiap naik busway ini https://t.co/OwGyyoRWEY","1823297774861037718","https://pbs.twimg.com/media/GU2nqITaMAAj8__.jpg","","in","0307","0","1","0","https://x.com/jiwajamal/status/1823297774861037718","1382572104466329601","jiwajamal"
"1823241721636896907","Tue Aug 13 06:14:35 +0000 2024","0","Keterlaluan banget 1 minggu belum ada kejelasan! Giliran orang pelanggaran keluar busway ga lewat gate jadi ga bayar diem2 aja ga ada perbaikan. Ini duit orang beli tiket via app tapi ga masuk diem2 aja lama banget ga direfund /pun kompensasi. Bobrok banget @PT_Transjakarta https://t.co/BRag8fC8S9","1823241721636896907","https://pbs.twimg.com/media/GU10rw-aoAAC3HR.jpg","","in","Jakarta","1","0","0","https://x.com/timmychristiann/status/1823241721636896907","179375583","timmychristiann"
"1822196035709448479","Sat Aug 10 08:59:24 +0000 2024","3","hari ini niatnya mau me time alias menyendiri tapi emang ditakdirinnya nambah relasi mulu tiap diniatin me time tuh hari ini ngobrol sama ibu-ibu yang lagi ngebolang naik busway karena anaknya udah pada kerja terus ketemu kakak Drg yang lagi lanjut spesialis random banget https://t.co/eNeN2wLyWC","1822196035709448479","https://pbs.twimg.com/media/GUm9oNjW4AAAqAN.jpg","","in","🌕🌔🌓🌒🌑","0","0","0","https://x.com/punyabellelele/status/1822196035709448479","1427151992690929671","punyabellelele"
"1822295548356927720","Sat Aug 10 15:34:49 +0000 2024","1","ON REPEAT ANJRIT AAAAA GUE RASANYA MAU TERIAK AJA DI INI BUSWAY ANJRIT MAHAEEE https://t.co/koENwa9Mpr","1822295548356927720","https://pbs.twimg.com/ext_tw_video_thumb/1822293583355092992/pu/img/k7-8BRxHSQ4eM7h5.jpg","","in","RPS ","0","1","0","https://x.com/mhist294/status/1822295548356927720","1720317971674071040","mhist294"
"1823157044486217740","Tue Aug 13 00:38:06 +0000 2024","5","Kebakaran di pemukiman di pintu barat (pintu ka bandara) Halte busway Manggarai Pasar Rumput ga beroperasi @bekasicommuter @CommuterLine @jalur5_ @AnkerTwiter https://t.co/VLisKyA257","1823157044486217740","https://pbs.twimg.com/media/GU0np0XawAAiK5r.jpg","","in","Jkt-Bdg (soon)","0","1","4","https://x.com/tonyarfian/status/1823157044486217740","97810286","tonyarfian"
"1823345743673118988","Tue Aug 13 13:07:56 +0000 2024","0","ㅤ ㅤ [ iMessage to ㅡ Bayi Besar ] Baby. I m ready to go! Jangan lupa pakai jaket ya. Kita naik busway atau pesan online saja. Nanti aku yang pesan kalau kamu mau. 𝙎𝙚𝙣𝙩. ㅤ https://t.co/mM37LVP63i","1823345743673118988","https://pbs.twimg.com/media/GU3TSZ-bgAAwipe.jpg","","in","©YAYA ㅡ MIA","1","1","0","https://x.com/klarndestin/status/1823345743673118988","1335852711787393025","klarndestin"
"1821914890157879566","Fri Aug 09 14:22:14 +0000 2024","3","bisa ga ya @DKIJakarta bikin peraturan kendaraan pribadi yang melintasi jalur busway halal buat ditabrak bus. Dan depan busnya dibuat baja buat giling logam. lumayan juga ngurangin kepadatan penduduk egois (bebal). https://t.co/BOouhLbr7a","1821914890157879566","https://pbs.twimg.com/ext_tw_video_thumb/1821914845828280321/pu/img/oHFeCU3K7AEJj3hS.jpg","","in","behind you","0","3","0","https://x.com/amos7nambela/status/1821914890157879566","2401265827","amos7nambela"
"1823373890967749069","Tue Aug 13 14:59:46 +0000 2024","4","Kegiatan Belajar Mengajar. Eh Koantas Bima. TJ 8E KBM-220010. https://t.co/uwCgqLgAFR","1823373890967749069","https://pbs.twimg.com/media/GU3s4vcbMAE-BaW.jpg","","in","Priority Seat","0","1","0","https://x.com/26Ceicei/status/1823373890967749069","124639815","26Ceicei"
"1822670797586219130","Sun Aug 11 16:25:56 +0000 2024","1","Anyway busway liat enih ak jd keinget era monster https://t.co/FJln2ByUVd","1822670797586219130","https://pbs.twimg.com/media/GUttbeTbAAAdcms.jpg","","in","121227 || day6 || baemon","0","1","0","https://x.com/dreamhigcha/status/1822670797586219130","1014678638271201280","dreamhigcha"
"1823493551428337906","Tue Aug 13 22:55:16 +0000 2024","4","Foto di busway https://t.co/uKPTI9JoeF","1823493551428337906","https://pbs.twimg.com/media/GU5Zt78bcAA-1Gs.jpg","","in","ÜT: -7.77071,110.36283","0","0","0","https://x.com/MuamarMasduki/status/1823493551428337906","531943817","MuamarMasduki"
"1822564477285658662","Sun Aug 11 09:23:27 +0000 2024","8","% matcha soft ice cream. % Arabica Jakarta PIK Drive Thru Pantai Indah Kapuk. https://t.co/9fEagb7jk8","1822564477285658662","https://pbs.twimg.com/media/GUsMtpabwAEtVBS.jpg","","in","Priority Seat","0","0","0","https://x.com/26Ceicei/status/1822564477285658662","124639815","26Ceicei"
"1822293627378483350","Sat Aug 10 15:27:12 +0000 2024","1","YANG BENER AJAA??? GUE LEMES BGT MASIH DI BUSWAY ANJRTRTT https://t.co/koENwaakeZ","1822293627378483350","https://pbs.twimg.com/ext_tw_video_thumb/1822293583355092992/pu/img/k7-8BRxHSQ4eM7h5.jpg","","in","RPS ","0","1","0","https://x.com/mhist294/status/1822293627378483350","1720317971674071040","mhist294"
"1823411486380965984","Tue Aug 13 17:29:10 +0000 2024","6","btw anw busway it must be there in a scene of my Indigo au (yang band band itu) tapi authornya lagi pusing jadi mohon bersabar ini ujian https://t.co/XAAbu9cEzg","1823411486380965984","https://pbs.twimg.com/media/GU4PFCEa4AE9XF-.jpg","","in","","0","0","0","https://x.com/bunnylikespeach/status/1823411486380965984","1668335571402625027","bunnylikespeach"
"1822964810881069483","Mon Aug 12 11:54:14 +0000 2024","0","Lie again ft galau di busway https://t.co/IBkCpalpkR","1822964810881069483","https://pbs.twimg.com/media/GUx41D-bYAAdiP9.jpg","","in","02l","0","0","0","https://x.com/Vtreas3/status/1822964810881069483","1280881152631267329","Vtreas3"
"1822990254682579251","Mon Aug 12 13:35:20 +0000 2024","0","Panicking 2mins before the war GAKUAT. Posisi lg di busway tolong bener2 out of nowhere. Makasi kakakku as always atas informasi yg sangat bermanfaat ini @Rose_Huening akhirnya moaraebang lagi! https://t.co/Et07nS5x2I","1822990254682579251","https://pbs.twimg.com/media/GUyP98yaMAAaayr.jpg","","in","📍 𝙢𝙤𝙖 𝙤𝙣𝙡𝙮","0","1","0","https://x.com/machhiatae/status/1822990254682579251","1398713552634929153","machhiatae"
"1821792154190278751","Fri Aug 09 06:14:31 +0000 2024","0","liat ignya jae ini kayak deket daerah koridor busway 13??? csw tirtayasa pasar santa atau rawa barat kah wkwk tp knp kocak sih liat storynya https://t.co/KrcpTCcyvE","1821792154190278751","https://pbs.twimg.com/media/GUhOSuIa8AIyq7_.jpg","","in","9401 6104","0","0","0","https://x.com/myeontempo/status/1821792154190278751","897510802084593664","myeontempo"
"1823334476250050613","Tue Aug 13 12:23:09 +0000 2024","163","Biasanya lihat lapangan ini kalau pas busway lewatin fly over Roxy. Nendangnya nggak boleh kenceng nih biar gak masuk sungai Ig : Didikkardiawan https://t.co/CeoQxGjCxA","1823334476250050613","https://pbs.twimg.com/ext_tw_video_thumb/1823333965954260992/pu/img/Di18G6yjROAikWKJ.jpg","","in","Stadion GBK","5","2","27","https://x.com/InfosuporterID/status/1823334476250050613","4379131152","InfosuporterID"
"1822648163448307877","Sun Aug 11 14:55:59 +0000 2024","1","btw busway kalo ada yg mau ngesave ini boleh bangett kokk tapi jgn claim itu editan klian ya walaupun ni hasilnya jlek tapi cape njirrr aku ngeditnya di hp yg sgt busuk shhshsh","1822648163448307877","","","in","she/her, 19","0","0","0","https://x.com/toniokamai/status/1822648163448307877","1720413896484487168","toniokamai"
"1823383816163275154","Tue Aug 13 15:39:13 +0000 2024","0","Busway pik bah...","1823383816163275154","","","in","","0","0","0","https://x.com/ASUdhlah/status/1823383816163275154","1293080624748666881","ASUdhlah"
"1823336995621609832","Tue Aug 13 12:33:10 +0000 2024","1","Tadi pagi vs barusan KYEOMSHU KENAPA KALIAN HOBI LIVE PAS GUE DI BUSWAY? https://t.co/O6U4jXYnOk","1823336995621609832","https://pbs.twimg.com/media/GU3LU5dagAAHO34.jpg","","in","00L // RPS // armycarat dni ❌","0","0","0","https://x.com/acoustic_forSHU/status/1823336995621609832","1513482585284161541","acoustic_forSHU"
"1822087569968103537","Sat Aug 10 01:48:24 +0000 2024","3","Lah ternyata cuma busway Ria SW Tidur Semalam Rocky Gerung https://t.co/nvIuu2TIjK","1822087569968103537","https://pbs.twimg.com/media/GUla_Q5a8AMlGJ5.jpg","","in","Makassar, Sulawesi Selatan","0","0","0","https://x.com/DenmasSojo/status/1822087569968103537","238384121","DenmasSojo"
"1823374261903585651","Tue Aug 13 15:01:15 +0000 2024","3","Kopi susu jakarta. Suasanakopi Blok M Kebayoran Baru. https://t.co/8j3QnkVDQy","1823374261903585651","https://pbs.twimg.com/media/GU3tMa_bgAAVvde.jpg","","in","Priority Seat","0","0","0","https://x.com/26Ceicei/status/1823374261903585651","124639815","26Ceicei"
"1822855706552520958","Mon Aug 12 04:40:42 +0000 2024","6","emg jalur busway jkt gada cctv apa buat tilang kendaraan yg melanggar? perasaan dr dulu gini mulu","1822855706552520958","","","in","","0","1","1","https://x.com/DamonDaleel/status/1822855706552520958","755422728","DamonDaleel"
"1823140963805737060","Mon Aug 12 23:34:12 +0000 2024","2","mampus dasar tolol GAADA OTAK KEJEBAK LU MAKAN TUH JALUR BUSWAY","1823140963805737060","","","in","","0","0","0","https://x.com/soulavya39/status/1823140963805737060","1196601658928553984","soulavya39"
"1823012849817723277","Mon Aug 12 15:05:07 +0000 2024","4","Soto betawi campur x S-tee. Soto Betawi Bang Lemi Suhadi Kebayoran Baru. https://t.co/uASDKhM8Ej","1823012849817723277","https://pbs.twimg.com/media/GUykfmJbEAASwz2.jpg","","in","Priority Seat","0","0","0","https://x.com/26Ceicei/status/1823012849817723277","124639815","26Ceicei"
"1823385913495580963","Tue Aug 13 15:47:33 +0000 2024","0","hari ini menerjang macet dari matraman ke rspp luar biasa untung busway nya sepi kalo berdiri mungkin sudah pingsan dan karena ga kuat jalan ngerasa napas bengek jadi lanjut ojol https://t.co/FR8LAuJbqT","1823385913495580963","https://pbs.twimg.com/media/GU330dgbUAAzFnb.jpg","","in","Jakarta Capital Region","0","0","0","https://x.com/neywidyanti/status/1823385913495580963","78902282","neywidyanti"
"1821537654124728669","Thu Aug 08 13:23:13 +0000 2024","2","ehh serius gw udah berapa tahun yah gan ke blok M... Terakhir ke blok pas mall bawah tanah itu ( belom ada busway )","1821537654124728669","","","in","kepo","0","0","0","https://x.com/Macllan69/status/1821537654124728669","1611934520672137216","Macllan69"
"1822623254957195382","Sun Aug 11 13:17:01 +0000 2024","0","Kecelakaan perihal nerobos jalur busway. Tolol emg","1822623254957195382","","","in","he/him  25+  ","0","0","0","https://x.com/muusangking/status/1822623254957195382","1778827646878855169","muusangking"
"1821481691644654003","Thu Aug 08 09:40:51 +0000 2024","1","Menunggu yang tidak pasti (kedatangan busway D01)","1821481691644654003","","","in","","0","1","0","https://x.com/jgnlupaframing/status/1821481691644654003","1781006881261260801","jgnlupaframing"
"1823328524176167106","Tue Aug 13 11:59:30 +0000 2024","0","Kenapa yaa disini gini mulu? Keknya emg gaada yg jaga ya ka? Cape bgt setiap ke sini pasti aja jadi macet karena mobil pribadi di jalur busway @PT_Transjakarta https://t.co/cgblGqnGJo","1823328524176167106","https://pbs.twimg.com/media/GU3Dn1JbwAAEXa5.jpg","","in","south korea","0","2","0","https://x.com/mutinrags/status/1823328524176167106","60298654","mutinrags"
"1823349220767936657","Tue Aug 13 13:21:45 +0000 2024","0","Ini efek gua tidur di busway dan kereta jd gatau kalo joshua live https://t.co/ZwMNzATIZQ","1823349220767936657","https://pbs.twimg.com/media/GU3Wc_4aMAA3Udb.jpg","","in","Depok, Jawa Barat","0","1","0","https://x.com/ourshunamon/status/1823349220767936657","1210015082140200960","ourshunamon"
"1822273675921404376","Sat Aug 10 14:07:55 +0000 2024","2","Tiba-tiba sudah 120. Fisioterapi ke-120 done. https://t.co/G5ModvmukB","1822273675921404376","https://pbs.twimg.com/media/GUoEPtBXQAEKquK.jpg","","in","Priority Seat","0","0","0","https://x.com/26Ceicei/status/1822273675921404376","124639815","26Ceicei"
"1822950762080850372","Mon Aug 12 10:58:25 +0000 2024","1","Ibuku dulu ditabrak busway juga awalnya marah banget sama supirnya. cuma semakin dipikir ya... emang udah takdirnya mau marah kaya gimanapun emang umur Ibuku cuma segitu. cuma bisa ikhlas aja. toh supirnya juga lagi cari nafkah","1822950762080850372","","","in","","0","2","0","https://x.com/telepon/status/1822950762080850372","1714267662459789312","telepon"
"1822931092200185912","Mon Aug 12 09:40:15 +0000 2024","1","ih iri x lah yAllah suka bgt liat jaringan busway mrk gak pelit halte busway + gak neko2 bikin JPO busway mrk panjang ny cuma 170 km tp jumlah penumpang ny udah 1 8 juta/hari (TJ cannot relate)","1822931092200185912","","","in","","0","1","0","https://x.com/gentrifybimbo/status/1822931092200185912","1117324791009009664","gentrifybimbo"
"1823024504060477661","Mon Aug 12 15:51:26 +0000 2024","0","Jalur mampang kuningan tiap jpo halte busway ada beginian ","1823024504060477661","","","in","","0","0","0","https://x.com/lookinkey/status/1823024504060477661","307902342","lookinkey"
"1822812533826424922","Mon Aug 12 04:53:32 +0000 2024","173","@ilham_hzrd20 @TfJakarta @adriansyahyasin Soalnya orang2 pada bilang Gunakan Busway agar lebih lancar bukan Gunakan Transjakarta agar lebih lancar ","1822858938812911992","","ilham_hzrd20","in","Jakarta","1","3","6","https://x.com/kura2giok/status/1822858938812911992","58405028","kura2giok"
"1823307602920644723","Tue Aug 13 10:36:22 +0000 2024","0","bisa bangetttt bahkan kemarin aku di busway ketemu pria matang sedang mengandung. dia duduk di kursi prioritas sambil mengusap perut nya kalau di lihat dari luar ya mungkin 1-2 minggu lagi melahirkan. aku sukaaaaa bangettt mpregggg ","1823307602920644723","","","in","Heejake♡ Sungjake♡ ","0","2","0","https://x.com/aiijkesim/status/1823307602920644723","1671503007492771840","aiijkesim"
"1822811008731377834","Mon Aug 12 01:43:05 +0000 2024","0","e-money gatau kenapa kalau ngetap di krl atau busway yg lebih cepet kebaca duluan dibanding flazz","1822811008731377834","","","in","","0","0","0","https://x.com/hjinbok/status/1822811008731377834","907574216198725632","hjinbok"
"1822870520326725944","Mon Aug 12 05:39:33 +0000 2024","0","((Kayanya kamu lebih hafal rute busway daripada plot novel yang kamu baca)) dieeemmm ga lu https://t.co/8YmgDAR5II","1822870520326725944","https://pbs.twimg.com/media/GUwjEWgaoAAATbC.jpg","","in","+62","0","0","0","https://x.com/valeraldehid/status/1822870520326725944","880695839324336129","valeraldehid"
"1823334659293651159","Tue Aug 13 12:23:53 +0000 2024","7","bertahun-tahun naik krl terus skrg pindah ke busway gue ga pernah ngalamin pelecehan sebelumnya dan gue pikir orang berani col* di public transport tuh orang goblok ternyata gue ketemu orang goblok itu dan dia duduk di sebelah gue ","1823334659293651159","","","in","","0","1","1","https://x.com/mantu_able/status/1823334659293651159","627050089","mantu_able"
"1822464620772327554","Sun Aug 11 02:46:40 +0000 2024","0","pagiee dari ak yg suda di busway","1822464620772327554","","","in","hati echil","0","5","0","https://x.com/leehdnghchn/status/1822464620772327554","1792192177906528258","leehdnghchn"
"1822180511730577618","Sat Aug 10 07:57:43 +0000 2024","0","lah kan emg monas mah deket jakut kocag. jalan jalan keliling jkt dulu yuk naik busway cuma 3500 sampe meninggal","1822180511730577618","","","in","","0","0","0","https://x.com/yeosangieo/status/1822180511730577618","807106220502827008","yeosangieo"
"1823179937949626538","Tue Aug 13 02:09:04 +0000 2024","0","Gue lah ini gatau gmn cara berhentinya kalo naik busway atau keluar tanpa nyumpel telinga. Kaya lebih aman aja soalnya ada yg nemenin di kuping aplg klo pergi sendiri (most of the time emg sendiri sih)","1823179937949626538","","","in","sir captain taeby 👶🏻","0","0","0","https://x.com/taefhyungie/status/1823179937949626538","1511510801672118278","taefhyungie"
"1823393890340384882","Tue Aug 13 16:19:15 +0000 2024","4","w kepikiran kenapa di beberapa titik busway yg memang rawan dilalui oleh kendaraan non tj pasang aja kamera etle. sekali denda kenain aja 5 jt gt biar mantap. untung bgt itu jkt","1823393890340384882","","","in","-6.889852,107.609968","0","1","0","https://x.com/aurelalberami/status/1823393890340384882","1947218550","aurelalberami"
"1823215360029720684","Tue Aug 13 04:29:50 +0000 2024","0","#racunshopee 2016 msh di Balikpapan kulitku sawo matang banget pindah ke Jakarta di 2022 malah jadi makin bersih kulitnya padahal disini polusinya lumayan ya udh gitu aku masih suka naik busway TJ Ternyata skincare yg tepat ngebantu banget buatku https://t.co/nfDxPRxZtH https://t.co/RCvNpALWPm","1823215360029720684","https://pbs.twimg.com/media/GU1cs4ya4AA5uRa.jpg","","in","Jakarta Capital Region","0","1","0","https://x.com/ollyvialaura/status/1823215360029720684","47546865","ollyvialaura"
"1823197930322358631","Tue Aug 13 03:20:34 +0000 2024","0","halo min dr halte pinang ranti ke sarinah rute busway nya gmn yaa? @PT_Transjakarta","1823197930322358631","","","in","neo ct","0","3","0","https://x.com/qanachanie/status/1823197930322358631","990579188615626753","qanachanie"
"1823160053526048784","Tue Aug 13 00:50:04 +0000 2024","0","Pantes aja telat busway akuuuu ","1823160053526048784","","","in","Italy","0","0","0","https://x.com/sogeumihada/status/1823160053526048784","1450974286710132744","sogeumihada"
"1822551895896203701","Sun Aug 11 08:33:28 +0000 2024","0","Ya Allah ini udah di busway mau kesono ","1822551895896203701","","","in","","0","1","0","https://x.com/seonranghae234/status/1822551895896203701","1720970860989972480","seonranghae234"
"1822232003367879081","Sat Aug 10 11:22:19 +0000 2024","0","Hari ini capek banget dari olahraga pulang pake busway tapi untungnya gw udh pake deo NIVEA MEN DEEP ESPRESSO yg buat gw wangi seharian jadi pede meskipun di angkutan umum. Ohiya guys tgl 10 agustus bakalan ada event di Cipete ikutan yuk! https://t.co/o5bF7N6zrG https://t.co/RocUR4bslY","1822232003367879081","https://pbs.twimg.com/media/GUneV_4acAAw7IX.jpg","","in","","0","0","0","https://x.com/thvl088/status/1822232003367879081","1633706400462553089","thvl088"
"1822252895313559870","Sat Aug 10 12:45:20 +0000 2024","0","Kenapa dulu bang Yos gak pake ini ya LRT ? Malah pilih Busway","1822252895313559870","","","in","Utara Bandung ","0","0","0","https://x.com/__anomali__/status/1822252895313559870","351134369","__anomali__"
"1822883412182544750","Mon Aug 12 06:30:47 +0000 2024","0","Kayanya banyak gerbang masuk tol yang kurang strategis. Maksa kendaraan ambil jalur busway buat masuk ke sana daripada membahayakan tiba tiba belok kanan nyebrangin jalur busway. Tapi ya sentimen nya emang buruk kendaraan masuk jalur busway","1822883412182544750","","","in","","0","0","0","https://x.com/aaaabimaa/status/1822883412182544750","1339175736943333376","aaaabimaa"
"1823299476640907410","Tue Aug 13 10:04:05 +0000 2024","0","sumpahhh hauss bgtt cuman lagi didalam busway ","1823299476640907410","","","in","","0","0","0","https://x.com/ksywon/status/1823299476640907410","1737515327339270149","ksywon"
"1821751523011129793","Fri Aug 09 03:33:04 +0000 2024","0","orang dongo... busway mahh jalan","1821751523011129793","","","in","Nassim Road, Singapore","0","0","0","https://x.com/YourN0t1/status/1821751523011129793","1428519600388337668","YourN0t1"
"1822234160410309092","Sat Aug 10 11:30:53 +0000 2024","1","Ifumi seafood dan liang teh. Rumah Makan Sinar Surya Bekasi Timur. https://t.co/nvr5dECMOj","1822234160410309092","https://pbs.twimg.com/media/GUngTGzWEAAeNrV.jpg","","in","Priority Seat","0","0","0","https://x.com/26Ceicei/status/1822234160410309092","124639815","26Ceicei"
"1822856633867014440","Mon Aug 12 04:44:23 +0000 2024","0","Muscle memory udah terbiasa belok ke busway.","1822856633867014440","","","in","","0","0","0","https://x.com/punkzlol/status/1822856633867014440","368156799","punkzlol"
"1822201952106856786","Sat Aug 10 09:22:54 +0000 2024","0","Klo naik busway bisa turun di jembatan baru and pindah 3e tapii inii gak setiap jam adaa yaa jdi prefer kalian ngegojek or grab ajaa","1822201952106856786","","","in","dreamland 🎀","0","0","0","https://x.com/bambiculture/status/1822201952106856786","1473923430927851522","bambiculture"
"1823311853046653410","Tue Aug 13 10:53:15 +0000 2024","0","Gak lucu gue nangis di busway ","1823311853046653410","","","in","slow reader 1/25📚","0","0","0","https://x.com/capekmin/status/1823311853046653410","1113471386985553920","capekmin"
"1822960512914911275","Mon Aug 12 11:37:09 +0000 2024","0","Jd keinget cerita supir busway yg mantan supir truk kaya udh jd sop non tertulis kalo nabrak org tu kek ah ga kuat gue ngetiknya karna terlalu sadis","1822960512914911275","","","in","Kasur","0","0","0","https://x.com/vernunline/status/1822960512914911275","1649449867","vernunline"
"1823200016066035887","Tue Aug 13 03:28:51 +0000 2024","0","busway sama jaklingko manggarai di alihin kemana ya?","1823200016066035887","","","in","contact us by DM💌","0","1","0","https://x.com/mtonjok/status/1823200016066035887","1383734619359510536","mtonjok"
"1821859882729079279","Fri Aug 09 10:43:39 +0000 2024","0","Selain udh naik pesawat sendiri kereta sndiri jogging sendiri first time naik MRT sendiri naik busway sendiri main di jkta sndiri aku pun baru cobaaa pilates sendiri so aku bangga sama diri sendiri https://t.co/4Ht8DY8wrD","1821859882729079279","https://pbs.twimg.com/media/GUiL6Aya8AAB1fb.jpg","","in","","0","3","0","https://x.com/orgbaikaamiiin/status/1821859882729079279","1453375209323450371","orgbaikaamiiin"
