"conversation_id_str","created_at","favorite_count","full_text","id_str","image_url","in_reply_to_screen_name","lang","location","quote_count","reply_count","retweet_count","tweet_url","user_id_str","username"
"1822602167532064961","Sun Aug 11 11:53:13 +0000 2024","1","Kwetiau goreng spesial dan liang teh. Kwetiau Akang PIK Golf Island Pantai Indah Kapuk. https://t.co/MaMePOMUQX","1822602167532064961","https://pbs.twimg.com/media/GUsu_9pbUAAyCs6.jpg","","in","Priority Seat","0","1","0","https://x.com/26Ceicei/status/1822602167532064961","124639815","26Ceicei"
"1822848247750390184","Mon Aug 12 04:11:03 +0000 2024","0","anw busway kapan tiketing fancon avakah ada online ","1822848247750390184","","","in","PLAVE 옆에💚","0","0","0","https://x.com/11yuhamin01/status/1822848247750390184","1757408939497435136","11yuhamin01"
"1822881668929335702","Mon Aug 12 06:23:52 +0000 2024","0","Ini mimpi saya juga sebagai warga Bekasi. Ada angkutan umum terintegrasi. Ada busway koridor Kalimalang. Dari Cawang sampai Cikarang","1822881668929335702","","","in","Bekasi, Jawa Barat","0","0","0","https://x.com/enjang_as/status/1822881668929335702","267655183","enjang_as"
"1821897299657945514","Fri Aug 09 13:12:20 +0000 2024","0","min @PT_Transjakarta busway 6u itu lewat halte busway duren tiga atau di bus stop pinggir jalannya dekat halte duren tiga ya?","1821897299657945514","","","in","need.tin.in.every.universe","0","1","0","https://x.com/nattzyui/status/1821897299657945514","1614924868700766208","nattzyui"
"1822062481474494955","Sat Aug 10 00:08:42 +0000 2024","0","oh iya gua blm cerita jadi sekitaran 2 hari lalu kan gua pulang kerja malem tuh jam 8(?)trs di busway ternyata ada org disabilitas dia kayak mau ngasih tau dia turun di halte ini tp gk ada yg ngerti jadi karna gua ngeh ya gua bantu tp gua gk bisa bahasa isyaratsedihh","1822062481474494955","","","in","","0","0","0","https://x.com/jumumom/status/1822062481474494955","1720971053617553408","jumumom"
"1822539365052195124","Sun Aug 11 07:43:40 +0000 2024","0","Gw tiap naik busway liat org make keyring truzz wkwkwkw","1822539365052195124","","","in","𝖧𝗈𝗆𝗈𝗉𝗁𝗈𝖻𝗂𝖼 𝖽𝗇𝗂","0","0","0","https://x.com/cheershby/status/1822539365052195124","1406796445194153990","cheershby"
"1823328524176167106","Tue Aug 13 14:01:19 +0000 2024","0","@mutinrags Selamat malam. Konfirmasi laporan mengenai sterilisasi jalur busway Koridor 9. Petugas sterililasi jalur sudah berada di sekitar Gedung MPR/DPR untuk menjaga sterilisasi jalur busway Koridor 9. Terima kasih ^RSN https://t.co/Wb3XMZIc7N","1823359178737651730","https://pbs.twimg.com/media/GU3fdLoaIAAY786.jpg","mutinrags","in","DKI Jakarta","0","0","0","https://x.com/PT_Transjakarta/status/1823359178737651730","104556071","PT_Transjakarta"
"1822634207975285152","Sun Aug 11 14:00:32 +0000 2024","7"," besok udah harus balik ketemu sama krl dan busway lagi","1822634207975285152","","","in","","6","33","3","https://x.com/convomf/status/1822634207975285152","1314975287294083073","convomf"
"1822868212134076508","Mon Aug 12 05:30:23 +0000 2024","1","Ya terus kapan abang sama adek ngumumin kalau mereka pacaran? Lu juga kemakan narasi sekte sesat tks btw anyway busway.","1822868212134076508","","","in","I'm not stan kpopshit","0","0","0","https://x.com/Chim13Koo/status/1822868212134076508","452882425","Chim13Koo"
"1822634960290779401","Sun Aug 11 14:03:32 +0000 2024","0","jing udh di busway pgn pipic","1822634960290779401","","","in","windows 10","0","0","0","https://x.com/dumpuwoos/status/1822634960290779401","1656460013446258688","dumpuwoos"
"1822227606952935508","Sat Aug 10 11:04:51 +0000 2024","0","trs pulangnya ak memutuskan utk naik gocar karna kalo naik busway UDA CAPE BGTTT eh abangnya malah kelewat jauhhhh bgtt anjj trs ak baru sadar ini ngechat nya kek ngechat temen https://t.co/ISsKujZXLI","1822227606952935508","https://pbs.twimg.com/media/GUnaWfwX0AAxb6h.jpg","","in","pacar doy","0","0","0","https://x.com/anotheraaiiii/status/1822227606952935508","1796847469999046656","anotheraaiiii"
"1821845886122782921","Fri Aug 09 09:48:02 +0000 2024","0","Tkut bgt jungwon ak kegencet org di busway https://t.co/VWfmn5m2PQ","1821845886122782921","https://pbs.twimg.com/media/GUh_LJJWwAAtllc.jpg","","in"," 「90% selling, 10% fangirling」","0","0","0","https://x.com/yyangjungwon/status/1821845886122782921","1304290725475971072","yyangjungwon"
"1821822500243964201","Fri Aug 09 08:15:06 +0000 2024","0","eh tolong dong full versionnya di up sekarang aja buat nemenin gw di busway semenit mah KURANG BANGETTTTT","1821822500243964201","","","in","metamongz gf","0","0","0","https://x.com/matchanyajamal/status/1821822500243964201","1720333030823530496","matchanyajamal"
"1821387923889303608","Thu Aug 08 05:32:49 +0000 2024","30","@KangManto123 Namaku kereta otonom Kerenkan Aku berasal dari China Aku bukan busway gandeng cuman mirip aja https://t.co/lFfOzbqOUF","1821419274256232860","https://pbs.twimg.com/media/GUb7LWpagAAg7FE.jpg","KangManto123","in","+62","0","3","2","https://x.com/cahh_keplek/status/1821419274256232860","1027699167580151808","cahh_keplek"
"1823239911052587058","Tue Aug 13 06:07:23 +0000 2024","0","hallo min mau nanya dong kalo dari halte busway MH Thamrin ke duren tiga itu busway yang mana ya? Makasih banyakk @PT_Transjakarta","1823239911052587058","","","in","","0","1","0","https://x.com/mateoimn/status/1823239911052587058","1550986641388408832","mateoimn"
"1823257198522167653","Tue Aug 13 07:16:05 +0000 2024","0","They really did 'naik busway' instead of 'naik Transjakarta'","1823257198522167653","","","in","Indonesia","0","0","1","https://x.com/TipeDarah/status/1823257198522167653","368837396","TipeDarah"
"1822862882545238035","Mon Aug 12 05:09:13 +0000 2024","0","gue alay bgt dapet busway warna pink aja a.k.a yang girl only gue seneng bgttt anjrrr mana sepi bisa duduk","1822862882545238035","","","in","LHS world","0","0","0","https://x.com/heezxvq/status/1822862882545238035","1601414338472202241","heezxvq"
"1823259763574210574","Tue Aug 13 07:26:16 +0000 2024","1","14.24 #LalinSonora Lalu lintas di depan Halte Busway Salemba UI terpantau padat merayap imbas ada peningkatan volume kendaraan. ( via BP. Septian) https://t.co/4N8ie2Ej09","1823259763574210574","https://pbs.twimg.com/media/GU2FF47bcAAyKJ1.jpg","","in","Jakarta Barat, DKI Jakarta","0","0","0","https://x.com/SonoraFM92/status/1823259763574210574","180696019","SonoraFM92"
"1822503680207429859","Sun Aug 11 05:21:52 +0000 2024","0","ni org org busway pada mau ke blok m semua kali ya tumben bgt minggu rame busway","1822503680207429859","","","in","","0","0","0","https://x.com/urbluem00n/status/1822503680207429859","1167391919015481345","urbluem00n"
"1822976404000264308","Mon Aug 12 12:40:18 +0000 2024","5","Mau jawaban yang mana ? A. Tambang Nikel B. Terminal Busway C. Alamat di komplek perumahan D. Sumur Minyak Bumi","1822976404000264308","","","in","Indonesia","1","1","1","https://x.com/hansssolo/status/1822976404000264308","219548433","hansssolo"
"1822639449760735384","Sun Aug 11 14:21:22 +0000 2024","0"," gara gara bahas ini itu sama Din di busway td jd sedih selama jalam pulang‼️⁉️ dEMMMM TERSADAR kalau gwe sayang banget SAMA WOONHAK UEE Eu E E EUE UUUUE eeue ee Uueuuue ueEe eeuee UeEE EEFE EUUUEHHEUEH","1822639449760735384","","","in","6012","0","0","0","https://x.com/unaginoona/status/1822639449760735384","732058375014494208","unaginoona"
"1823354353576747187","Tue Aug 13 13:42:08 +0000 2024","0","Tolong lah di sini juga terapin. Gw gedek bgt sama kendaraan yg masuk jalur busway tolong gimana ga marah marah tiap hariiii","1823354353576747187","","","in","","0","0","0","https://x.com/muuunyako/status/1823354353576747187","1432345118955098113","muuunyako"
"1823235814190424272","Tue Aug 13 05:51:06 +0000 2024","0","halo kak @PT_Transjakarta minta rute busway dari rest area km 13 merak jakarta ke plaza timur gbk","1823235814190424272","","","in","","0","3","0","https://x.com/absltract/status/1823235814190424272","1543396874102509568","absltract"
"1823390133888163891","Tue Aug 13 16:04:19 +0000 2024","0","Ih iya!! gue ampe nyasar naik busway pdhal bisa aja naik busway yg biasa gue naikin tp malah ngide naik busway yg lain alhasil gue muter2 ada sejam setengah wkwkw. Dahal biasanya cuma setengah jam sampe","1823390133888163891","","","in","Jakarta","0","0","0","https://x.com/joshonlee/status/1823390133888163891","123863962","joshonlee"
"1823001260825710706","Mon Aug 12 14:19:04 +0000 2024","0","Rill anjir di busway orang pake TWS pada kenceng2 bgt sampe gw duduk sebelahnya aja kedengeran. Meledak ngga tu kuping","1823001260825710706","","","in","DKI Jakarta, Indonesia","0","0","0","https://x.com/fujimiyaaaw/status/1823001260825710706","144740697","fujimiyaaaw"
"1822083729646649800","Sat Aug 10 01:33:08 +0000 2024","0","moots di Tangerang daerah alsut sama Serpong itu ada busway gakkk??","1822083729646649800","","","in","magic island, Neverland ","0","0","0","https://x.com/fairyofkey/status/1822083729646649800","1671801715065249793","fairyofkey"
"1822236665005343002","Sat Aug 10 11:40:51 +0000 2024","0","AAAA GUE LAGI DI BUSWAY GK BISA TERIAK","1822236665005343002","","","in","","0","0","0","https://x.com/mintchoconeo/status/1822236665005343002","1443744778655387649","mintchoconeo"
"1822804511821594910","Mon Aug 12 01:17:16 +0000 2024","0","halo kak @PT_Transjakarta pagii mau tanya kaa kalo mau ke arah rukan taman meruya adakah busway ke arah sana?kalo dr cibubur","1822804511821594910","","","in","Indonesia","0","1","0","https://x.com/queencyklt/status/1822804511821594910","1267681524020703234","queencyklt"
"1822260256325398986","Sat Aug 10 13:14:35 +0000 2024","0","abis coba ke uin naik buswayy overall sih enak gusy tp paling ak hrs mengorbankan waktu KARENA LAMAAA BGTT BUSWAY NYAA ️️️","1822260256325398986","","","in","","0","4","0","https://x.com/oxynonyn/status/1822260256325398986","1471487304380215296","oxynonyn"
"1822660633315172659","Sun Aug 11 15:45:33 +0000 2024","0","angkutan umum tp spesifik busway or krl mrt lrt kl angkot mending pribadi","1822660633315172659","","","in","","0","0","0","https://x.com/ryutaflo_/status/1822660633315172659","1251595311765577728","ryutaflo_"
"1822845677073805467","Mon Aug 12 04:00:50 +0000 2024","13","Sering2 Busway ngeprank gini kedepannya. Biar pada kapok. ","1822845677073805467","","","in","Indonesia","0","0","0","https://x.com/BetaKopites/status/1822845677073805467","1093997036985147392","BetaKopites"
"1823259350993170671","Tue Aug 13 07:24:38 +0000 2024","1","14.24: Lalu lintas di depan Halte Busway Salemba UI terpantau padat merayap imbas ada peningkatan volume kendaraan. (P. Septian) #InfoLalinElshinta https://t.co/RLME15wybU","1823259350993170671","https://pbs.twimg.com/media/GU2EtLLbUAApsT2.jpg","","in","","0","0","0","https://x.com/RadioElshinta/status/1823259350993170671","121640063","RadioElshinta"
"1823129455466061985","Mon Aug 12 22:48:28 +0000 2024","0","aku udah bangun pagi biar gak telat naik busway tapi kenapa harus mules sih?! ","1823129455466061985","","","in","🌕🌔🌓🌒🌑","0","0","0","https://x.com/punyabellelele/status/1823129455466061985","1427151992690929671","punyabellelele"
"1822534727401897999","Sun Aug 11 07:25:14 +0000 2024","0","wtb tiket sounds project day 3 need cepet yg bisa skrgg #wts #zonauang #tsp","1822534727401897999","","","in","","0","19","0","https://x.com/naomibertanya/status/1822534727401897999","1549071229717737472","naomibertanya"
"1822866659025334596","Mon Aug 12 05:24:13 +0000 2024","2","Pernah kaya gini pas naik 1A. Jalanan kosong mereka malah memilih masuk jalur busway. Bus depan ada masalah sama roda. Belakang ada bus lagi. Saya yang di-bus MAMAM! walau hati ketar-ketir karena saya juga kejebak ","1822866659025334596","","","in","Indonesia","0","0","0","https://x.com/LarasBambang/status/1822866659025334596","157857185","LarasBambang"
"1822862629226131618","Mon Aug 12 05:08:12 +0000 2024","0","busway mah jalanan buat bus","1822862629226131618","","","in","🩻","0","0","0","https://x.com/KUDALUMPlNG/status/1822862629226131618","1244607852406140929","KUDALUMPlNG"
"1822565410161480148","Sun Aug 11 09:27:10 +0000 2024","0","Memikirkan tingkah laku Jokowi sambil nunggu busway","1822565410161480148","","","in","","1","0","0","https://x.com/geminijahat/status/1822565410161480148","1331514314386071552","geminijahat"
"1821824644716134609","Fri Aug 09 08:23:37 +0000 2024","0","POV gw ketika naik busway :","1821824644716134609","","","in","","0","0","0","https://x.com/RatnaAp24/status/1821824644716134609","1410963656809066497","RatnaAp24"
"1821915444028305615","Fri Aug 09 14:24:26 +0000 2024","0","jelek bgt gw nahan nangis di busway","1821915444028305615","","","in","doyoung, ten & seunghan","0","0","0","https://x.com/hshonglee/status/1821915444028305615","1638747765626007557","hshonglee"
"1822963433203179660","Mon Aug 12 11:48:46 +0000 2024","0","Eh anjirr gua pernah diginiin juga tapi bukan fb lupa aplikasi apaan tapi waktu itu gua iya iya aja buat download terus disuruh daftar gitu tapi karna busway yg gua tunggu dateng akhirnya ga jadi asli emang di jakarta atau dimana aja harus hati2","1822963433203179660","","","in","dnf me first","0","0","0","https://x.com/Jeongshuaya_/status/1822963433203179660","912409099","Jeongshuaya_"
"1822956757943304460","Mon Aug 12 11:22:14 +0000 2024","1","Dua Mushola Di Halte Busway Bunderan HI Di Kunci. Sudah Buru-buru.. Eh Dikunci... @PT_Transjakarta","1822956757943304460","","","in","","0","1","0","https://x.com/Ololehomask02/status/1822956757943304460","1603659087606034433","Ololehomask02"
"1823281384263405845","Tue Aug 13 08:52:11 +0000 2024","1","kalau ke sarinah naik busway bisa gak???","1823281384263405845","","","in","smt-jkt","0","3","0","https://x.com/Nezyjpann/status/1823281384263405845","1414261370699227139","Nezyjpann"
"1823202830406050180","Tue Aug 13 03:40:02 +0000 2024","0","Ini yg dislipi bukan sih Emang banyak yg masuk ke jalur busway klo disitu wkwkwk","1823202830406050180","","","in","purbalingga-tangerang","0","0","0","https://x.com/AwtPrnm/status/1823202830406050180","500785767","AwtPrnm"
"1821922357218570697","Fri Aug 09 14:51:54 +0000 2024","0","rate hari ini 3/10 cokkkkk niat ke blok m pgn healing gtaunya malah pusing NUNGGU BUSWAY LAMA BGT HAMPIR 2 JAM + BUSWAY PADET BGT SESEK PUSING BGT MUAL SAMPE PGN MUNTAH EH MALAH BOCIL YG MUNTAH","1821922357218570697","","","in","","0","0","0","https://x.com/newjeaaa/status/1821922357218570697","1789134795823620096","newjeaaa"
"1822946745384575000","Mon Aug 12 10:42:27 +0000 2024","0","ini ada 2 sisi ya antara si sender emang minjem barang tersebut atau ngga. or ngasih barang tapi ga ikhlas soalnya gue pernah di posisi cowok ini tapi ya cuma 1 barang alias jaket gue pinjemin ke dia karena waktu itu keadaan lg di busway malem2 &amp; dingin mangkanya gue pinjemin.","1822946745384575000","","","in","20++ He/him","0","2","0","https://x.com/dvpegg/status/1822946745384575000","1487381881339342849","dvpegg"
"1823162133858963946","Tue Aug 13 00:58:20 +0000 2024","0","keknya gue lebi nangis kudu naik jpt ke halte tj juanda deh.. berasa hiking ajg naik naik mulu astaga.. blm lagi td gue lari dari tangga muter balik nabrak orang demi dpt busway ke pecenongan MAAF YAA MBAA SIAPAPUN ITUU ini antara idup dan mati ","1823162133858963946","","","in","0307","0","0","0","https://x.com/jiwajamal/status/1823162133858963946","1382572104466329601","jiwajamal"
"1822250455574909199","Sat Aug 10 12:35:39 +0000 2024","0","Lagi kacau banget terus di busway ada mba mba tas link caholnya Woozi turun di duri kepa wkkwkw Agak senyum dikit tadi kwkwk kek gemes","1822250455574909199","","","in","02l","0","1","0","https://x.com/Vtreas3/status/1822250455574909199","1280881152631267329","Vtreas3"
"1822567364648685997","Sun Aug 11 09:34:56 +0000 2024","0","Jujur salut sama org yg bisa naik krl gua lebih pilih nyasar jauh2 pake busway lrt atau mrt tapi kalo krl menyerah anxienty gua kambuh kalo di krl lemes bgt mama","1822567364648685997","","","in","'⁰¹","0","2","0","https://x.com/yeppihans/status/1822567364648685997","2496060260","yeppihans"
"1823344379605680479","Tue Aug 13 13:02:30 +0000 2024","0","anjir gua bener bener sendirian di busway yang ada buntutnya","1823344379605680479","","","in","","0","2","0","https://x.com/shermasyitaa/status/1823344379605680479","1009826771502395393","shermasyitaa"
"1822900829126295857","Mon Aug 12 07:40:00 +0000 2024","1","Kemacetan terjadi setelah Fly Over Pancoran arah Kuningan. Banyak kendaraan pribadi serobot busway sehingga mengganggu bus yang akan berhenti di halte. https://t.co/5dk2eNwd2V","1822900829126295857","","","in","","0","0","0","https://x.com/MorganFreeman_X/status/1822900829126295857","69183155","MorganFreeman_X"
"1823235315076878685","Tue Aug 13 05:49:07 +0000 2024","0","Pertama kali naik busway dan salah naik bus ok","1823235315076878685","","","in","134340","0","1","0","https://x.com/sabitarius/status/1823235315076878685","1076319748974043136","sabitarius"
"1822428182076965290","Sun Aug 11 00:21:52 +0000 2024","0","Nekat ke hoyofest naik busway njink ","1822428182076965290","","","in","","0","0","0","https://x.com/bocilkayang/status/1822428182076965290","1275356029677522946","bocilkayang"
"1822781881349505525","Sun Aug 11 23:47:20 +0000 2024","0","BRO MANA INI BUSWAY YG KOSONG BROOO ELAH P @ tj","1822781881349505525","","","in","wannaones home","0","0","0","https://x.com/_byeongalien_/status/1822781881349505525","997059473138069505","_byeongalien_"
"1822496860113870901","Sun Aug 11 04:54:46 +0000 2024","1","Deym. Di busway jd lama bgt grgr fbr ini nutupin jalan kyk yg pny jalan","1822496860113870901","","","in","","0","0","0","https://x.com/firleeyours/status/1822496860113870901","1014592821997604864","firleeyours"
"1822808858550829355","Mon Aug 12 01:34:32 +0000 2024","0","Naik busway aja apa yak","1822808858550829355","","","in","Mampang Prapatan, Indonesia","0","0","0","https://x.com/yourrianahehe/status/1822808858550829355","243109540","yourrianahehe"
"1822972457327767781","Mon Aug 12 12:24:37 +0000 2024","0","Kesalahan trbesar gue lagi adalah Nyoba naik busway di jam pulang kerja di hari senin tujuan blok m - lt. Agung Agustus huruf keduanya g gegegegegelo","1822972457327767781","","","in","Bandung, Jawa Barat","0","0","0","https://x.com/Nindyeilish/status/1822972457327767781","2173905241","Nindyeilish"
"1822564888943992904","Sun Aug 11 09:25:05 +0000 2024","0","Kudu ke tempat magang minta ttd gue males bgt lagi naik busway mata gue kunang2 mulu soalnya gegara kurang darah","1822564888943992904","","","in","","1","0","0","https://x.com/lalalobeuO07/status/1822564888943992904","1035865550721757184","lalalobeuO07"
"1822971206360093084","Mon Aug 12 12:19:39 +0000 2024","0","Kayaknya bukan sekali ini mual dari busway listrik","1822971206360093084","","","in","ÜT: -2.9290313,104.7425539","0","0","0","https://x.com/mariasilaen/status/1822971206360093084","234760128","mariasilaen"
"1822919437332385867","Mon Aug 12 08:53:56 +0000 2024","0","hallo @PT_Transjakarta saya mau nanya untuk rute dari halte busway sumur bor mau ke emporium Pluit mall lewat mana yaa? terima kasih","1822919437332385867","","","in","free palestine 🇵🇸","0","1","0","https://x.com/herwinners/status/1822919437332385867","1499773390403473411","herwinners"
"1823360717602615410","Tue Aug 13 14:07:26 +0000 2024","0","Pake segala salah naik busway ","1823360717602615410","","","in","Jakarta Capital Region, Indone","0","0","0","https://x.com/Zendydwg/status/1823360717602615410","161556484","Zendydwg"
